{
  "version": 1,
  "updatedAt": "2026-08-19T09:10:00.000Z",
  "lists": [
    {
      "id": "list-personal",
      "name": "Osobiste",
      "createdAt": "2026-08-01T08:00:00.000Z"
    }
  ],
  "notes": [
    {
      "id": "note-interview",
      "title": "Pytania na rozmowę",
      "body": "Sprawdzić, czy przepływ Dzisiaj jest zrozumiały.",
      "kind": "checklist",
      "items": [
        { "id": "item-1", "text": "Pokazać dodawanie zadania", "checked": true },
        { "id": "item-2", "text": "Zapytać o dziennik posiłków", "checked": false }
      ],
      "tags": ["badanie", "ios"],
      "listId": "list-personal",
      "color": "blue",
      "pinned": true,
      "archived": false,
      "createdAt": "2026-08-18T18:00:00.000Z",
      "updatedAt": "2026-08-19T09:10:00.000Z"
    }
  ]
}
